authors,text,title,link
"['Ravi Agrawal', 'Devesh Kapur', 'Sushant Singh', 'Aaron David Miller', 'Steven Simon', 'Scott Kennedy', 'Robert Zaretsky', 'Antonio De Loera-Brust', 'Brian Hioe', 'Stephen M. Walt']","From pundits to polls, there was a wide expectation this year that Indian Prime Minister Narendra Modi would not just win a rare third consecutive term but would secure an even bigger parliamentary majority than he had before. As it emerged on Tuesday, India’s voters had other ideas. Modi’s Bharatiya Janata Party (BJP) won the most seats—more than the entire opposition alliance combined—but will need the help of coalition allies to form a government. Modi has never needed to share power before, and it’s anyone’s guess as to how he will adapt to the vulnerabilities of coalition politics.

From pundits to polls, there was a wide expectation this year that Indian Prime Minister Narendra Modi would not just win a rare third consecutive term but would secure an even bigger parliamentary majority than he had before. As it emerged on Tuesday, India’s voters had other ideas. Modi’s Bharatiya Janata Party (BJP) won the most seats—more than the entire opposition alliance combined—but will need the help of coalition allies to form a government. Modi has never needed to share power before, and it’s anyone’s guess as to how he will adapt to the vulnerabilities of coalition politics.

What will the surprising election results mean for politics in India and for India’s place in the world? I spoke with two experts on FP Live: Milan Vaishnav, the director of the South Asia program at the Carnegie Endowment for International Peace, and Yamini Aiyar, the former president of New Delhi’s Centre for Policy Research. Subscribers can watch the full discussion on the video box atop this page or download the FP Live podcast. What follows is a condensed and lightly edited transcript.

Ravi Agrawal: There was a wide expectation that Modi would return to power in a landslide. He didn’t. What went wrong?

Milan Vaishnav: If we rewind the clock to January and February of this year, before voting began, every pre-election survey pointed in one direction. And that was an overwhelming majority for the BJP, plus seats for the BJP’s allies known as the NDA. Exit polls reconfirmed that as recently as June 1. But that’s not what we saw. We saw a BJP that fell short of a governing majority. It will only be in power thanks to the help and assistance of its coalition partners.

The overarching message or takeaway for me was that it really wasn’t clear what this election was about. It’s such an obvious question to ask, but I have no answer for it. And this really hurt the BJP. There was no defining economic, national security, emotive issue. And what ended up happening, in broad strokes, was more of a classic state-by-state contest where local factors, incumbency, caste equations, party dynamics, alliances mattered much more. The BJP is on much weaker ground there. They have been the incumbent for 10 years. They have a motley group of opposition parties which have banded together with the explicit purpose of keeping the BJP out of power. There was some upset within the BJP’s ranks. They replaced over 100 of their sitting MPs, bringing in defectors and turncoats from other parties. This is important because the BJP is a rank-and-file, cadre-based party, so they don’t necessarily take very kindly to people coming from the outside. And so they really struggled to do something that we think of as part of the BJP’s strength, which is crafting a narrative.

But it was really the opposition, on the campaign trail, which was very disciplined in its messaging, hitting the government hard on the state of the economy, inequality, social injustice. And unlike opposition campaigns of the past, they stayed on message. They were nimble and they were very clever. It was the first time in a while when you saw opposition social media ads and you laughed out loud because of how cutting they were.

RA: Yamini, there’s been a lot of commentary about how democracy has been challenged in India. Do the results show that democracy is, in fact, alive and well in India?

Yamini Aiyar: Every poll and, frankly, everybody from elites and opinion-makers to opposition parties and people out of the ivory towers had the same sense that Modi is going to come back. It was, in fact, on the back of that confidence that they coined the phrase “Char Sau Paar,” meaning this time we will cross more than 400 [seats in parliament]. Five hundred and forty-three is the total number of seats, so if you hit 400, you’ve achieved hegemonic dominance.

At the start of the campaign, a set of actions was taken by the government that gave a sense that dominance was now full and complete. In January, there was the consecration of the Ram Temple, a long-standing contestation around India’s secularism and Hindu identity, in which it looked like the Hindu national narrative had won. The prime minister was a sole priest, publicly and visibly participating as the key actor in the consecration ceremony. All over the city, people celebrated this huge achievement of what had really been the heart and soul of the struggle of the Hindu nationalist movement through the ’80s and ’90s, which was when they rose.

The slide into authoritarianism had begun a long time ago, but it accelerated in some ways in those two months before the elections, hitting a crescendo when one of the leading opposition voices was jailed days before the campaign officially began. The Congress Party, the leading opposition party, comes out saying, “Our accounts have been frozen.” And in the backdrop of this, several other politicians have investigative agencies chase after them, civil society is completely curbed. There was a sense that there is no space for active political contestation, that dominance has been achieved, that this election was going to be won before it even began. And then the campaign started.

As the campaign unfolded, the BJP had one national agenda. So I disagree with you, Milan. There was a national agenda. It’s just that agenda wasn’t as exciting to all voters. The national agenda was Modi, Modi’s charisma, Modi’s personality, Modi’s omnipresence, his mesmerizing charm, the spell that he had cast on the Indian voter over these last 10 years. And it was Modi’s guarantee, which is the title of the BJP manifesto. Modi was the sole and only campaigner.

The opposition, which was struggling to figure out how to create cohesion, was listening and engaging in some remarkable ways. The first and most important thing was the economy, as Milan mentioned. People wanted to hear from the BJP what they had to say about the two things that were hurting them the most, particularly in north India, which was unemployment and, linked to that, inflation. Early in the campaign, some BJP leaders, perhaps in their hubris, let out that there was some thinking about changing the constitution. And that is why they needed total dominance. The Indian electorate was already beginning to wonder about this total dominance. This idea of “crossing 400” had a sense of arrogance that was beginning to become uncomfortable. And you saw this in the growing emergence of social media influencers who were really hitting out at the authoritarian tendencies of the government. Their numbers started rising, a sign that voters were looking for something else. This, combined with this challenge to the constitution, became a live issue which the opposition was able to harness into a cohesive narrative and link it very interestingly to caste politics. Suddenly, caste was back in contention because the constitution was written by B. R. Ambedkar, who is a very important figure for lower-caste politics in India. But also the constitution contains hard-fought rights linked to reservations [affirmative action]. So the opposition built this into a narrative about social justice. The voter, too, was beginning to express an exhaustion with the constant polarization and the constant authoritarianism. These were the messages that eroded support for Modi, and that’s where the election landed.

RA: If Modi does indeed form a government, he’ll have to rely on coalition allies. How do you think he and his party will approach power sharing? And what do you think that means for governance?

MV: We are truly in uncharted territory. Narendra Modi was the chief minister of the state of Gujarat, the state’s chief executive, for 13 years. He always had an overpowering single-party majority. When he transitioned to national life as prime minister in 2014, for the past 10 years, he has always had a dominant majority. Yes, he had coalition allies. They were extraneous. They were superfluous. He didn’t need them. He campaigned with them. He let them come along for the ride. He didn’t count on them to prove his majority on the floor of parliament.

We’re in a completely different scenario here. We have two political parties: the Telugu Desam Party, which is the ruling party in the southern state of Andhra Pradesh, and the Janata Dal (United), part of the ruling alliance with the BJP in the state of Bihar. Together, they have about 30 seats. They could make or break this government. So they are going to extract their pound of flesh. This is not something that Narendra Modi has a lot of practice doing. Those of us who have watched him over the past two decades are really not sure how he’s going to manage. His style of governance is very much top-down: centralizing power, working with the bureaucracy, cutting out members of the cabinet. But you’re now going to have your key coalition partners who are going to have important positions in the Council of Ministers.

All of a sudden, you may even have a party which has two seats in the national parliament of 543, which is going to say, “No, no, no. If I leave, this is going to hurt you.” We don’t know how he’s going to manage because he’s never had to do this before.

RA: Yamini, from the 1980s onward, most Indian administrations were coalition governments, and one can say that Modi between 2014 and 2024 was a sort of exception to that norm. How do coalition governments tend to do in India?

YA: Coalitions work in India because of the peculiar nature of India’s politics. As democracy deepened, coalition politics, state politics, regional politics became very important ways in which ethnic anxieties, linguistic anxieties, caste-related pressures for access to state power found accommodation. So it is really about the fundamental principle of democracy, which is a politics that becomes accommodative for a large country like India, with multiple fissures and deep forms of inequality. It sometimes can slow decision-making down.

I think that cooperation, dialogue, deliberation—which are at the heart of coalition politics—are good for India. It may mean that decisions cannot be taken immediately, but the decisions that are taken are more long-standing. So I don’t think there’s much for us to worry about. We have experienced dominance, we know its limits, and we know that it’s really important to have checks and balances. The Indian voters’ message, in my reading of this election, is a nuanced message. It’s a message that says, “Modi, we’re not completely giving up on you, but we don’t like how you’ve done stuff. So you’re a little bit on notice.” And to the opposition, “We’re kind of interested but not fully convinced, so you’re on notice, too.” It’s on both of them. So if the opposition, which is now a little stronger, uses parliament productively for serious debate, I think we will actually end up with far more useful economic reform. Our growth trajectory is at a place where much of what needs to be done requires cooperation with states, and so coalitions will help move us in that direction.

MV: The empirical evidence is very clear. Economic growth has been better and higher under coalition governments than single-party majorities. It is true that it is harder to enact new reforms, but it is also harder to undo old reforms. When you have a country that’s slowly moving in a more pro-market direction, I think it’s important. But the second part of what Yamini said is equally important, which is there’s also an institutional corollary here. When you have a more fragmented, multipolar political system, independent institutions like the Election Commission, like the Supreme Court, like the Reserve Bank of India, like various anti-corruption accountability institutions, they have space and don’t feel suffocated. They don’t feel the need to pay excessive deference to the ruling party. Some of these institutions, which have really not been very effective for the past 10 years, might start reclaiming some of that space back.

YA: But this is uncharted territory for Modi and his comrade in arms, Amit Shah. They have never been in a situation where they are not in total control. It really depends on how they read the mandate. Do they read the mandate like I do, as a nuanced mandate where the electorate is saying, “Some things you did, we don’t like, so stop.”? Or do they read it to say, as some of their Twitter trolls have been doing, which is, “The Hindus have let us down. Those cross-caste coalitions have let us down. Let’s go back to our core agenda.”? Will they then act as wounded animals and push back even further? They still have powers. It’s really about whether they shift their governance strategy or whether they double down, because now they are in a slightly weaker position and have to reestablish their dominance.

RA: What do you imagine other incumbent leaders around the world might draw from Modi’s relatively underwhelming performance this time?

MV: We always have this debate about whether, to defeat someone like [former U.S. President Donald] Trump, we need a counter-Trump on the Democratic side. One lesson in this election is, there is no leader to this opposition of more than two dozen parties. You don’t necessarily need another kind of larger-than-life personality to go against the incumbent populist leader. The second is that this was, in some ways, an issue-based campaign on the opposition side honed in on this idea of inequality. They stuck with it, and then they linked it to other issues. They linked it to reservation. They linked it to caste. They linked it to the two-speed economy. But they were pretty message-disciplined in talking about the core vulnerability of this government. That is, the headline numbers are beautiful, but you scratch the surface and there’s a lot of distress underneath. The third is, and it might seem somewhat flippant, but humor. There was a sense of mockery, of fun. You would have these doom-and-gloom speeches from the prime minister and others about how Muslims and other minorities were going to take your wealth away from you and redistribute amongst the masses. And the opposition would put out these parody videos with actors made to look like Amit Shah and Narendra Modi, poking fun!

RA: Yamini, it has been well documented that press freedom has declined in India in recent years. Reflect a little bit on whether there are limits to how leaders can deploy mass media to their advantage.

YA: There are certain pieces of an authoritarian playbook: Media control and money control are two critical ones, with civil society control being the third.

In mid-April, this social media influencer, whom I had heard about a little bit, just pops up. He’s like a kid sitting in Germany, straight out of Haryana, talking about dictatorship. And it was interesting. It was funny. I watched the whole thing. My mom, who’s over 80, called me up and said, “Have you watched it?” And then we both had a giggle. And then my colleague, Neelanjan [Sircar], with whom I wrote about this, we started going out into the field. We were in the middle of the rural hinterland of Uttar Pradesh, which is some of the poorest parts of India. Everybody now has a phone. And everywhere we went, there was at least one person, if not more, who was talking about this Dhruv Rathee and his videos. The videos were getting more and more powerful, and popping up more and more every day. We started asking people, “Where do you get your information? Where do you get your news?” We’ve seen this in other surveys, too. Anyone who was under the age of 45 was getting their news from YouTube and WhatsApp. And there’s a dark side to WhatsApp and YouTube, no doubt.

But in this instance, it increasingly began to be clear that people were looking for alternative spaces, alternative voices. And many of these were voices of people who had voted for BJP in 2019, voted for BJP in the state election in 2022, but were now increasingly talking about unemployment, dictatorship. There’s a word in Hindi, “tanashahi,”—dictatorship—that suddenly shows up everywhere, and that word became popular because of this social media influencer. We also found that even visible, hardcore BJP supporters, the local mobilizers, who if you pushed a little bit, they say, “Yes. TV media will only give you Modi, Modi, Modi.” So social media emerged as this alternative space. The right wing used to use it very effectively. In 2014, 2019, social media played a crucial role in harnessing the darker side of bigotry and hate speech. This time around, I’m not saying that went away, but the other side who were looking for other sources of information found a space to vent their frustrations or to hear views that were more aligned with their feelings through social media. That played a very important role in energizing voters who were feeling uncomfortable about what was going on.

RA: Assuming Modi is prime minister for another five years, do you expect his foreign policy to change or adapt, especially given that he will now be running a coalition government?

MV: I don’t think so. The structure of geopolitics right now is such that India just has a lot of room to maneuver. There are three big trends that we can point to. The first is declining American hegemony. We’re moving away from a kind of unipolar moment to a more multipolar, fragmented world order. Number two, clearly, is the increased concern, not least in India, but also the United States and Europe and other places, about Chinese expansionism and their alternate vision of the Indo-Pacific in Asia and the global order. And then third, of course, is the return of a more global Russia despite all of its problems. And so India finds itself in this geopolitical sweet spot, where it can pursue its policy. They’ve gone from calling it nonalignment to multi-alignment. But basically it pursues bespoke partnerships with particular countries in particular issues in domains. So working with the United States on defense technology at the same time that they can be importing Russian crude is the classic example. Those structural factors aren’t changing.

So the kind of assertiveness, the confidence, the brashness that you see from Indian diplomats connotes a sense that, to some degree, the world needs India more than India needs the world. Now, that has been heightened a bit because of the Modi government’s own arrogance, and that’s maybe been taken down a peg. But fundamentally I don’t think this changes much about the nature of India’s partnerships, what its priorities are, and who it seeks to work with.

RA: Nationalism has been such an important force in India, but particularly under the Modi government, that has morphed into jingoism. Do you expect that to change under a coalition government, or is it part of an Indian psyche that cuts across party lines?

YA: In the rush of trying to analyze why Modi was sort of “cut down to size,” as one newspaper headline put it, we also need to recognize that certain elements of what he has brought into Indian politics, in terms of the political dialogue and discourse, haven’t gone away. Jingoism and muscular nationalism—maybe the two are interconnected—and this idea that India has arrived on the global stage, shedding its sense of colonial victimhood, aggressive, that is something that resonated with voters. It’s treated as an achievement of this government. I don’t think voters have rejected it. I don’t know that voters have necessarily rejected the polarization, the bigotry, as much as just said, “This is not enough. We also want to hold you accountable for our everyday lives.”

So while the constitution went from being an abstract issue into something that was real with reservations, there are many other important things about liberalism, about freedoms, about liberty, about secularism that are very serious works in progress. Those have not found their way into the domain of mass politics. And I do think that there is a political consensus around muscular nationalism, particularly projected on the global stage.",Why Modi Underperformed,https://foreignpolicy.com/2024/06/06/india-election-modi-bjp-nda-coalition/
