authors,text,title,link
"['Pathi Covers India', 'The Wider South Asia Region. She Is Based In New Delhi.']","NEW DELHI (AP) — Since coming to power a decade ago, Prime Minister Narendra Modi has been known for big, bold and often snap decisions that he’s found easy to execute thanks to the brute majority he enjoyed in India’s lower house of parliament.

In 2016, he yanked over 80% of bank notes from circulation in an effort to curb tax evasion that sent shockwaves through the country and devastated citizens who lost money. In 2019, his government pushed through a controversial law that stripped the special status of disputed, Muslim-majority Kashmir with hardly any debate in parliament. And in 2020, Modi swiftly brought in contentious agriculture reforms — though he was forced to drop those about a year later after mass protests from farmers.

In his expected next term as prime minister — when he will need a coalition to govern after results announced Wednesday showed his Hindu nationalist party fell short of a majority — Modi may have to adapt to a style of governance he has little experience with, or desire for.

And it’s not clear how that will play out.

“Negotiating and forming a coalition, working with coalition partners, grappling with the tradeoffs that come with coalition politics — none of this fits in well with Modi’s brand of assertive and go-it-alone politics,” said Michael Kugelman, director of the Wilson Center’s South Asia Institute.

The surprising election results upended widespread expectations before the vote and exit polls that suggested a stronger showing for Modi’s Bharatiya Janata Party. In the end, the party won 240 seats — short of the 272 needed to form the government on its own. But the coalition it belongs to, the National Democratic Alliance, secured a majority in the 543-seat lower house that should allow Modi to retain power in the world’s most populous nation.

“India cuts Modi down,” read one Indian newspaper headline on Wednesday, referring to the 642 million voters as well as the opposing INDIA alliance, which clawed seats away from the BJP.

This is both a major setback and unknown territory for Modi, who has never needed his coalition partners to govern since first becoming prime minister in 2014. It has left him the most vulnerable he has been in his 23-year political career.

“These results show that the Modi wave has receded, revealing a level of electoral vulnerability that many could not have foreseen,” said Kugelman.

India has a history of messy coalition governments — but Modi, who has enjoyed astronomical popularity, offered a respite, leading his BJP to landslide victories in the last two elections. His supporters credit him with transforming the country into an emerging global power, matched by a robust economy that’s the world’s fifth-largest.

That economy, however, is in some trouble — and fixing it will now require partners. His opponents focused on vulnerabilities despite the brisk growth, like unemployment, inflation and inequality — but his campaign offered few clues to how he might address those.

“Modi hardly addressed the question of unemployment — they skirted around it,” said Yamini Aiyar, a public policy scholar.

It’s not just that Modi will have to adapt to relying on a coalition. The election has also left him diminished after he spent a decade building a persona of absolute invincibility, said Milan Vaishnav, director of the South Asia Program at the Carnegie Endowment for International Peace.

At the heart of his governance style has been his penchant for control, critics say, adding that Modi has increasingly centralized power.

But now to stay in power, Modi will have to do whatever he can to maintain a stable coalition, meaning he may have to govern in a way that is more collaborative since the smaller regional parties in his alliance could make or break his government.

The BJP’s lackluster performance is “undoubtedly a slap in the face,” Vaishnav said, of Modi, who confidently predicted at his first election rally in February that the party would secure more than 370 seats — 130 more than it did.

The gap between the high expectations Modi and others set for the BJP and its actual performance has left the victors looking like losers and the defeated feeling victorious.

Still, Vaishnav said “we shouldn’t lose sight that the BJP is still in the driver’s seat.”

To be sure, his most consequential Hindu nationalist policies and actions are locked in — including a controversial citizenship law and Hindu temple built atop a razed mosque. His critics and opponents decry those policies, saying they have bred intolerance and stoked religious tensions against the country’s Muslim community — and left India’s democracy faltering, with dissent silenced and the media squeezed.

Now, his agenda, and ability to push through policies going forward could face fiercer challenges, especially from a once deflated but now resurgent opposition.

The INDIA alliance, led by the Congress party, will likely have more power to apply pressure and push back, especially in parliament where their numbers will grow.

“Modi is Modi. But I would say that with the attitude with which he ran the country until now, he will definitely face some problems now,” said Anand Mohan Singh, a 45-year-old businessman in the capital, New Delhi. “Some changes will be visible.”

___

Associated Press video journalist Shonal Ganguly contributed to this report.","India’s Modi is known for charging hard. After a lackluster election, he may have to adapt his style",https://apnews.com/article/india-election-results-2024-lok-sabha-pm-modi-41eadd4a74cd13b5e5b9ceca0d7b2f31
[],"Why India's Modi failed to win outright majority

4 June 2024 By Soutik Biswas , @soutikBBC, India correspondent Share

AFP The results are a personal blow to Mr Modi, who has never fallen short of a majority

Indian PM Narendra Modi has won a third consecutive term in a much tighter general election than anticipated. His Bharatiya Janata Party (BJP) looks set to fall short of a majority and is leading in the 543-seat parliament, below the required 272 seats. However its coalition partners have gained additional seats. The results are a personal blow to Mr Modi, who has always secured majorities in elections as both chief minister of Gujarat state and India’s prime minister, and dominated the country's politics for a decade. The verdict marks a surprising revival for the Congress Party-led INDIA opposition alliance, defying earlier predictions of its decline, and sharply diverging from both exit polls and pre-election surveys. More than 640 million people voted in a marathon seven-week election, hailed as a ""world record"" by election authorities. Nearly half of the voters were women.

Getty Images The opposition has staged a remarkable comeback under Rahul Gandhi

Many world leaders have crawled across the finishing line in their third term elections and Mr Modi is no exception. The BJP remains India’s single largest party by seats, and if Mr Modi secures a third term with his allies, the prime minister matches the record of Jawaharlal Nehru, India’s first premier. But the significant loss of seats for his party - more than 50 - dims the allure of a third term, especially given Mr Modi's campaign targeting 400 coalition seats, making anything less seem like an under-achievement. This has led to jubilation in the Congress camp and some despair in BJP quarters. Despite the BJP emerging as the single largest party, the burden of hype and expectations has left many of their supporters disheartened. Mr Modi's supporters believe securing a third term can be attributed to several factors: a record of stable governance, the appeal of continuity, efficient welfare programmes, and the perception that he has enhanced India's global image. To his Hindu nationalist base, Mr Modi delivered on key manifesto promises: revoking the autonomy of Indian-administered Kashmir, building the Ram temple in Ayodhya and implementing a controversial citizenship law. Many BJP-ruled states have implemented laws tightening regulations on interfaith marriages.

AFP Mr Modi appealed to his Hindu nationalist base by building the Ram temple in Ayodhya

The BJP's significant drop in seats may be linked to joblessness, rising prices, growing inequality and a controversial army recruitment reform, among other things. Mr Modi's harsh and divisive campaign, particularly targeting Muslims, could also have alienated voters in some regions. His ambitious slogan ""Ab ki baar, 400 paar,"" aiming for more than 400 seats for his NDA alliance, may have backfired, with such a massive majority raising fears of constitutional changes among the poor. Mr Modi’s party faced its largest setback in Uttar Pradesh (UP), a state larger than the United Kingdom and three times as populous. With 80 parliamentary seats, UP holds significant sway in national politics - many consider it the gateway to Delhi. Both Mr Modi and Rahul Gandhi hold seats there.

AFP The election results show that Brand Modi has lost some of its shine

So what are the main takeaways of this election? A dent of Brand Modi Mr Modi’s popularity has been also attributed to his mastery of branding, transforming routine events into spectacles and astute messaging. A weak opposition and a largely friendly media also helped him build his brand. The election results show that Brand Modi has lost some of its shine, indicating that even Mr Modi is susceptible to anti-incumbency. In other words, he is not as invincible as many of his supporters believed. This offers renewed hope to the opposition. A return to coalition politics India has a history of chaotic coalition governments, although some in the early 1990s and 2000s played a significant role in implementing economic reforms. If the BJP forms the government, it will be dependent on allies and will need to adopt a more consultative and deliberative approach. This dependency makes it vulnerable to collapse if allies feel neglected. The party, once perceived as all-powerful, is now reliant on allies, unlike in 2014 and 2019.

AFP Akhilesh Yadav and Rahul Gandhi have forged a successful coalition in Uttar Pradesh

A jolt to the dominant BJP Mr Modi's uninterrupted decade-long reign at the top has underscored India's embrace of what some political scientists term the one-party dominant system. This has five key traits: a charismatic leader, unrivaled control over resources and communication, unmatched organisational machinery, and an opposition in disarray. Shrinking freedoms also characterise a one-party dominant system. Mr Modi’s BJP is not the first party to dominate Indian politics. For many years after Independence the Congress ruled without a break. Tuesday’s result has restored India to what many consider ""normal politics"", with a range of parties sharing and competing for power.

Getty Images N Chandrababu Naidu's regional TDP is an ally of Mr Modi

A resurgent opposition The results will energise the much-criticised Congress-led opposition. In February, the diverse coalition known as INDIA, short for Indian National Developmental Inclusive Alliance, faced turmoil when one of its key leaders, Nitish Kumar, exited - only to later rejoin the BJP. But led by Rahul Gandhi, the opposition ran a spirited campaign and narrowed the gap, in the face of a partisan media and despite fewer resources. There is more hope for them ahead. The BJP holds about a third of India’s 4,000- plus state assembly seats and has lost to regional parties before. Over the next 14 months, five states are set for elections - all could be keenly contested. With contests in Maharashtra, Jharkhand, and Haryana this year, the BJP could face substantial competition. Delhi's upcoming election may pose challenges, while Bihar in October presents a regional hurdle.

What worked for India's Modi and what didn’t?",India election 2024: Why Modi failed to win outright majority,https://www.bbc.com/news/articles/c977g8gl5q2o
